Тип вакансии;Название вакансии;Мин. зарплата (рублей);Макс. зарплата (рублей);Тип зарплаты;Требуемый опыт (лет);Город;Компания;Требуемые навыки;Дата публикации
Backend разработчик;Руководитель команды backend разработки;;;;;Санкт-Петербург;Версус Сервис;;28.05.2026
Backend разработчик;Middle Backend Developer (Golang);157500;;gross;3.0;Елабужский район;Алабуга. Управление цифровой трансформации;Golang, PostgreSQL, Git, Backend, Go;22.05.2026
Backend разработчик;Middle Backend Developer (Golang);157500;;gross;3.0;Елабужский район;Алабуга. Управление цифровой трансформации;Golang, PostgreSQL, Git, Backend, Go;22.05.2026
Backend разработчик;Разработчик бэкенда в Яндекс Образование;;;;3.0;Санкт-Петербург;Яндекс;Python, Golang;29.05.2026
Fullstack разработчик;Fullstack разработчик PHP+JS;230000;260000.0;net;;Москва;ООО Джем-Софт;PHP, MongoDB, JavaScript;08.06.2026
Fullstack разработчик;Fullstack-разработчик / Fullstack Developer;150000;250000.0;gross;3.0;село Поляны;ООО Интер Парк;;08.06.2026
Fullstack разработчик;Fullstack-разработчик;200000;;net;;Москва;БИТ;MS SQL, PostgreSQL, JSON API, HTML, JavaScript, Bootstrap;07.06.2026
Fullstack разработчик;Fullstack-разработчик;;;;3.0;Москва;Made of Storm;Node.js, Python, PHP;09.06.2026
Fullstack разработчик;Fullstack-разработчик (Flutter + Laravel);70000;90000.0;net;;Москва;ООО Медориа40;Laravel, Flutter;09.06.2026
Fullstack разработчик;Старший Fullstack-разработчик (Vue.JS+PHP);;350000.0;net;;Москва;ООО МФК Фордевинд;jQuery, Git, Laravel, PHP, VueJS;09.06.2026
Fullstack разработчик;Fullstack-разработчик;100000;180000.0;gross;3.0;Москва;Инрэко ЛАН;MySQL, PostgreSQL, React, VueJS, .NET Framework, С#;04.06.2026
Fullstack разработчик;Fullstack-разработчик (React + Node.js) (отдел поддержки сайтов);;180000.0;gross;;Москва;Пиксель Плюс;Node.js, PHP, Git, API, 1С-Битрикс;08.06.2026
Fullstack разработчик;Fullstack-разработчик PHP;;;;;Москва;ГКУ Инфогород;PHP, VueJS, PostgreSQL, Laravel, Symfony;09.06.2026
Fullstack разработчик;Junior Fullstack-разработчик;60000;90000.0;gross;;Санкт-Петербург;Fora Soft (Фора Софт);JavaScript, Atlassian Jira, Аналитическое мышление, Node.js, Git, SQL, HTTP, ООП, MongoDB, React, React Native, Веб-программирование, Linux, Английский — B1 — Средний;04.06.2026
Fullstack разработчик;Fullstack разработчик / Fullstack Developer;70000;;net;;Пермь;ООО Вайт Рэбит;1С-Битрикс, PHP, jQuery, Git, ООП, CSS, HTML, JavaScript, MySQL, SQL, Bitrix Framework, Scrum, Agile, Битрикс24, REST, API, XML;09.06.2026
Fullstack разработчик;Fullstack разработчик (PHP);;;net;3.0;Санкт-Петербург;Аргус-Спектр;PHP, MySQL, CSS, MVC, Laravel, JavaScript, PostgreSQL, Windows Server, Shell;08.06.2026
Fullstack разработчик;Fullstack программист-разработчик (JavaScript, NodeJS, React);;;;;Москва;ЗАО НПЦ ИРС;Node.js, React, PostgreSQL, Блочная верстка, Разработка ПО, Веб-программирование, SQL, Базы данных, СУБД, REST, Redis, Docker, Инициативность, Ответственность, Деловое общение, JavaScript, TypeScript;09.06.2026
Fullstack разработчик;Fullstack-разработчик C#;;;;;Москва;Фонд развития промышленности;C#, .NET Framework, JavaScript, VueJS, TypeScript, Atlassian Jira, Atlassian Confluence;07.06.2026
Fullstack разработчик;Ведущий fullstack разработчик (senior .NET JavaScript);;;;;Москва;ЗАО КонсультантПлюс;JavaScript, .NET Framework;08.06.2026
Fullstack разработчик;Fullstack Desktop Developer (Cross-platform);220000;250000.0;net;3.0;Москва;Юнитест;;07.06.2026
Fullstack разработчик;PHP Fullstack разработчик;;;;3.0;Тула;ООО Выберу.ру;HTML5, React, VueJS, PHP, Symfony, Laravel, MS SQL, PostgreSQL, Redis, RabbitMQ;02.06.2026
Fullstack разработчик;Fullstack разработчик (.NET C#/Angular);;;;3.0;Москва;ООО Лоция;.NET Core, Angular, TDORP;04.06.2026
Fullstack разработчик;Senior backend (fullstack) разработчик C++;;;;;Москва;ЗАО КонсультантПлюс;;04.06.2026
Fullstack разработчик;Fullstack-разработчик (Астра Облако);;;;;Москва;Группа компаний Астра;C++, Linux, Git, Bash, JavaScript;03.06.2026
Fullstack разработчик;Разработчик Fullstack Python/Django;;;;3.0;Москва;АО Компания ТрансТелеКом;REST API, Python, PostgreSQL, Django Framework, JS, Kubernetes, RabbitMQ;03.06.2026
Fullstack разработчик;FullStack тестировщик (Java) Middle-;;175000.0;gross;;Москва;DCloud;Java, SQL;06.06.2026
Fullstack разработчик;Fullstack-аналитик;;;;3.0;Москва;ООО ИЦ АЙ-ТЕКО;;04.06.2026
Fullstack разработчик;Fullstack-разработчик (Node.js);;;;3.0;Москва;RIS group;Node.js, JavaScript, React, PostgreSQL, MongoDB;01.06.2026
Fullstack разработчик;Senior fullstack-разработчик;;;;;Москва;РБК;PHP, Laravel, VueJS, Gitlab, Kubernetes;01.06.2026
Fullstack разработчик;Senior fullstack-разработчик (Vue.js, Python);;;;3.0;Москва;МАГНИТ, Розничная сеть. IT;Python, VueJS;03.06.2026
Fullstack разработчик;Senior Fullstack-разработчик;;;;3.0;Краснодар;ООО 4 пикселя +;Node.js, Python, PHP, VueJS, React;01.06.2026
Fullstack разработчик;FullStack Разработчик (С++, Qt);;;;3.0;Москва;Star-Staff;C++, Qt, Linux, PostgreSQL;02.06.2026
Fullstack разработчик;Fullstack-Разработчик Typescript (офис);;;;3.0;Казань;АО ИНКОМСИСТЕМ, НИЦ;Node.js, TypeScript, JavaScript, React, Git, Next.js, Electron;02.06.2026
Fullstack разработчик;Javascript fullstack (React. js, Node. js) разработчик;120000;200000.0;net;;Москва;АО Медиа Эффект;JavaScript, Node.js, MySQL, Git, React, PostgreSQL;04.06.2026
Fullstack разработчик;Fullstack-разработчик;;;;3.0;Воронеж;InternetWeb;Node.js, PHP, Golang, Grafana, SWIFT Alliance, Yii, Linux, Puppet, Нейронные сети, Docker-compose, Docker, PHP7;29.05.2026
Fullstack разработчик;Fullstack-разработчик;100000;;net;;Омск;DATAFOOD;PHP, Git, VueJS, Laravel, MySQL, PostgreSQL, TypeScript, Redis, Apache Kafka, RabbitMQ, Docker, Docker-compose;29.05.2026
Fullstack разработчик;Fullstack-разработчик;200000;;net;3.0;Барнаул;ГлавПро Федеральный институт повышения квалификации;PHP, MySQL, HTML, REST API, Laravel, React, SOLID, DDD, PHPUnit, SaaS;17.05.2026
Fullstack разработчик;Senior Fullstack Developer/ Team Lead;;;;;Москва;Clear Mind;;29.05.2026
Fullstack разработчик;Middle fullstack-разработчик (JS/TS и PHP/Python);;;;3.0;Казань;FIX;JavaScript, PHP, MongoDB, PostgreSQL, TypeScript, Docker, Atlassian Jira, Atlassian Confluence, Python;29.05.2026
Fullstack разработчик;Fullstack аналитик ERP (MS Axapta / Navision);;;;3.0;Москва;MERLION TECH;ERP, MS Dynamics NAV, MS Navision, Navision, AXAPTA, MS Axapta, SQL, Постановка задач разработчикам;02.06.2026
Fullstack разработчик;Middle Fullstack Developer;;;;3.0;Москва;ООО Буханка;JavaScript, Node.js, MongoDB, VueJS, Docker, 1С: Управление Торговлей, REST API;25.05.2026
Fullstack разработчик;Fullstack разработчик (WordPress);;;;3.0;Москва;TecHuntr;Wordpress, PHP, JavaScript, HTML, MySQL, CSS;20.05.2026
Fullstack разработчик;Fullstack QA Java специалист (Fintech, уровень Junior/ Middle–);;175000.0;net;;Ростов-на-Дону;DCloud;;03.06.2026
Fullstack разработчик;Fullstack-разработчик лабораторной информационной системы;;;;3.0;Москва;ФГБУ ЦСП ФМБА России;JavaScript, Python;25.05.2026
Fullstack разработчик;Fullstack-разработчик (Techlead);;;;;Ижевск;Directum;C#, SQL, .NET Core, TypeScript;20.05.2026
Fullstack разработчик;Ведущий fullstack-аналитик;350000;400000.0;gross;;Москва;RedLab;Аналитическое мышление, BPMN, UML, Анализ бизнес-процессов, Системный анализ;29.05.2026
Fullstack разработчик;Junior+ Fullstack разработчик в B2B SaaS;;;;;Ульяновск;Flow Medium;TypeScript, React, GitHub, Английский — A2 — Элементарный;28.05.2026
Fullstack разработчик;Fullstack Developer;;;;;Москва;ООО Студия Олега Чулакова;JavaScript, React, Claude, Node.js;20.05.2026
Fullstack разработчик;Senior Fullstack Developer (.NET / React);;;;3.0;Москва;ООО Информационные Системы в Здравоохранении;JavaScript, PostgreSQL, Linux, .NET Framework, .NET Core, React, С#;28.05.2026
Fullstack разработчик;Fullstack-разработчик (.Net/React);;150000.0;gross;;Москва;DDPlanet;;22.05.2026
Fullstack разработчик;Fullstack-разработчик;;;;;Астрахань;ООО «АйСиЭл Сервисез» (Москва);;14.05.2026
Fullstack разработчик;Fullstack-разработчик;;;;3.0;Москва;ООО Ростелеком Информационные Технологии;;14.05.2026
Fullstack разработчик;Fullstack разработчик;100000;;net;;Пермь;Love.ru;Git, PHP, PostgreSQL, JS;14.05.2026
Fullstack разработчик;Fullstack-разработчик;;;;3.0;Москва;iConText Group;;13.05.2026
Fullstack разработчик;FullStack разработчик (Bitrix);200000;210000.0;net;3.0;Санкт-Петербург;FINNTRAIL (ООО Финэкип);PHP, JavaScript, Git, Node.js, HTML, jQuery, Битрикс24, API;18.05.2026
Fullstack разработчик;Fullstack программист-разработчик;250000;;net;3.0;Москва;ООО Хайвэй Медиа;;18.05.2026
Fullstack разработчик;Fullstack Golang Developer (Middle);150000;200000.0;net;3.0;Казань;Пигалев Дмитрий Евгеньвич;Golang, PostgreSQL, Docker, React, TypeScript, JWT, Swagger;19.05.2026
Fullstack разработчик;QA Инженер (Auto\Fullstack);;;;3.0;Москва;Сбер. IT;;19.05.2026
Fullstack разработчик;Fullstack-разработчик (React + Python/FastAPI) — AI Agents Platform;150000;;net;3.0;Санкт-Петербург;ООО Овелфиш;React, TypeScript, Python, FastAPI, PostgreSQL, ORM, REST API, HTML5, CRM, SQLAlchemy;14.05.2026
Fullstack разработчик;PHP Developer / Laravel Developer / Fullstack PHP + Vue.js;150000;250000.0;net;3.0;Москва;ИП Кляшторный Андрей Владиславович;PHP, Laravel, MySQL, VueJS, JavaScript, Git, REST API, ООП, SOLID, MVC, SQL, Redis, Docker, Linux, Nginx, Telegram, API;24.05.2026
Fullstack разработчик;Middle Fullstack Developer (Shopify + WordPress);150000;;gross;;Москва;ООО HAAS PLATFORM;Shopify, Wordpress, CRM, API, HTML, CSS, Liquid, WooCommerce, SCSS, Английский — B1 — Средний;12.05.2026
Fullstack разработчик;Senior QA Engineer (Fullstack);;262500.0;gross;3.0;Москва;Romantic lines LP;Smoke-тестирование, REST API, TestRail, MySQL, Atlassian Jira, Postman, Java, Selenium, Gitlab;15.05.2026
Fullstack разработчик;Системный аналитик (Senior fullstack);;;;3.0;Москва;ООО Раппорто;HTTP, REST API, JSON, SQL, BPMN;15.05.2026
Fullstack разработчик;Middle Fullstack C# Developer;200000;230000.0;net;3.0;Москва;ООО Смарт Мил Сервис;C#, Entity Framework, .NET Core, Git, gRPC, REST API, LINQ, PostgreSQL, SOLID, ООП, WPF;14.05.2026
Fullstack разработчик;Senior Backend / Fullstack Developer (CRM + API + вычислительная логика);;;;;Москва;Моложин Матвей Евгеньевич;PostgreSQL, REST API, Docker, Redis, RabbitMQ, Node.js, SQL, Git, Linux, Работа с базами данных, Базы данных, Аналитическое мышление, Разработка технических заданий;17.05.2026
Системный аналитик;Системный аналитик;230000;250000.0;net;3.0;Москва;ABCstaff;;09.06.2026
Системный аналитик;Системный аналитик;;;;3.0;Москва;Security Vision;UML, BPMN, Системный анализ, Моделирование бизнес процессов, Разработка технических заданий, UC, US, Разработка функциональных моделей, Ревью тест-кейсов, Сбор и формализация, аналитика, ERD, методологии, Разработка ПО, Информационная безопасность;09.06.2026
Системный аналитик;Системный аналитик;;;;;Москва;ФГБУ ГИВЦ Минкультуры России;SQL, PostgreSQL, IDEF, UML, BPMN, Camunda, MS Excel;09.06.2026
Системный аналитик;Системный аналитик;;;;3.0;Москва;ООО МФК ВЭББАНКИР;;09.06.2026
Системный аналитик;Системный аналитик;;;;3.0;Москва;ООО Colvir Software Solutions;Системный анализ, Аналитическое мышление, BPMN, Camunda, ORACLE, PostgreSQL;09.06.2026
Системный аналитик;Системный аналитик;;250000.0;gross;3.0;Москва;ООО Финтехник;Системный анализ;09.06.2026
Системный аналитик;Системный аналитик;180000;300000.0;net;;Москва;Клируэй Текнолоджис;Системный анализ, Agile, Scrum, UML, BPMN, IDEF, REST API, SOAP, SQL, Zabbix, Prometheus, Английский — B2 — Средне-продвинутый;09.06.2026
Системный аналитик;Системный аналитик / Бизнес-аналитик;;200000.0;net;3.0;Москва;ООО Адакта;Системный анализ, Бизнес-анализ, Страхование, Информационные технологии, JavaScript, SQL, Английский язык, Андеррайтинг, Актуарные расчеты, Системная интеграция, Английский — B1 — Средний;09.06.2026
Системный аналитик;Системный аналитик;;;;3.0;Москва;R-Style Softlab (Эр-Стайл Софтлаб);Jira, SQL, Figma, Postman, PlantUML, Camunda, Bizagi, Постановка задач разработчикам;09.06.2026
Системный аналитик;Системный аналитик;;;;;Москва;МойСклад;REST API, BPMN, UML, JSON API, Системный анализ;09.06.2026
Системный аналитик;Системный аналитик;;;;;Москва;ООО Сорб групп;SQL, Системный анализ, ГОСТ 34, JSON API, PostgreSQL, Постановка задач разработчикам, Atlassian Jira, Atlassian Confluence;09.06.2026
Системный аналитик;Системный аналитик;260000;;gross;3.0;Санкт-Петербург;АО Аркадия;BPMN, SQL, PostgreSQL, JSON, XML, Atlassian Jira, Postman;09.06.2026
Системный аналитик;Системный / Продуктовый аналитик;;;;;Санкт-Петербург;Altenar;Системный анализ, Анализ требований, Английский язык, Английский — B2 — Средне-продвинутый;09.06.2026
Системный аналитик;Системный аналитик;;;;;Ростов-на-Дону;Т-Банк. ИТ. Аналитика;UML, Системный анализ, BPMN, SQL, REST, REST API;09.06.2026
Системный аналитик;Системный аналитик;;;;;Екатеринбург;ПАО КБ Уральский банк реконструкции и развития (УБРиР);SQL, СУБД, SAP CRM, BPMN/UML, API, Postman;09.06.2026
Системный аналитик;Системный аналитик;;;;;Москва;ООО СберМедИИ;Системный анализ, Техническая документация, REST API, JSON API, MedTech;09.06.2026
Системный аналитик;Ведущий системный аналитик;;;;;Москва;ПАО Московская Биржа;;09.06.2026
Системный аналитик;Системный аналитик;;;;;Москва;Цифровой аудит;;08.06.2026
Системный аналитик;Системный аналитик;;;;;Нижний Новгород;Лига Цифровой Экономики;;08.06.2026
Системный аналитик;Системный аналитик;;;;;Екатеринбург;ООО 42;Atlassian Jira, Atlassian Confluence, Деловая коммуникация, JSON API, Draw.io, Confluence, Анализ данных, BPMN, UML, Postman, REST, SQL, MS Excel, ГОСТ 34;08.06.2026
Системный аналитик;Системный аналитик (Middle / Middle+ / Senior);;;;3.0;Тюмень;CRT;Системный анализ, Бизнес-анализ, Сбор и формализация требований, SQL, BPMN, UML, REST API, Use case, User Story;09.06.2026
Системный аналитик;Системный аналитик (LLM, NLP, RAG, AI-агенты);;;;3.0;Москва;Diasoft;RAG, MCP, SGLang, Python, Go, Системный анализ, QWEN;09.06.2026
Системный аналитик;Старший системный аналитик ELMA365;;;;3.0;Москва;РТК-ЦОД;;09.06.2026
Системный аналитик;Системный аналитик;;;;;Новосибирск;Ангиофарм;;08.06.2026
Системный аналитик;Ведущий системный аналитик (развитие АБС ЦФТ-Банк, ИБСО);;;;;Новосибирск;АО Азиатско-Тихоокеанский Банк;Разработка бизнес-требований, Анализ АБС, BPMN, JSON API, UML, XML, REST, SOAP, Анализ требований, Разработка функциональных требований, Разработка технических заданий;09.06.2026
Системный аналитик;Системный аналитик;;;;3.0;Санкт-Петербург;ООО МЭДИКС.ТЕХ;Системный анализ, Бизнес-анализ, Сбор требований, Английский — B2 — Средне-продвинутый;08.06.2026
Системный аналитик;Senior System Analyst (Системный Аналитик);;;;;Москва;ИП Казарьянц Артур Эдуардович;BPMN, UML, API, XML, SQL, Postman;08.06.2026
Системный аналитик;Младший системный аналитик департамента ИТ;;;;;Москва;Красное & Белое, розничная сеть;Разработка инструкций, Разработка технических заданий, Тестирование разработок, Взаимодействие с разработчиками 1С;09.06.2026
Системный аналитик;Системный аналитик (сетевые технологии);;;;;Санкт-Петербург;ООО Датаджайл;Информационная безопасность, Проектирование ЛВС;08.06.2026
Системный аналитик;Аналитик данных;;;;;Санкт-Петербург;ООО Бэйби Опт Груп;Power BI, Исследовательский анализ данных, Математическая статистика, MS Excel, Формирование аналитической отчетности, SQL;09.06.2026
Системный аналитик;Системный аналитик 1С: ERP;;;;3.0;Долгопрудный;ПАО ДНПП;;08.06.2026
Системный аналитик;Бизнес-аналитик (финансы);250000;;net;;Москва;ROSSKO;;09.06.2026
Системный аналитик;Системный аналитик 1С: Зарплата и управление персоналом (ЗУП);;;;;Челябинск;Красное & Белое, розничная сеть;1С: Зарплата и управление персоналом, Системный анализ, Оптимизация бизнес-процессов, Автоматизация, Разработка инструкций, Постановка задач разработчикам, Техническое задание, Моделирование бизнес процессов;09.06.2026
Системный аналитик;Системный аналитик 1С ERP;;;;3.0;Казань;АЗС ИРБИС;;08.06.2026
Системный аналитик;Системный аналитик 1С (Казначейство);;;;3.0;Москва;ПИК-специализированный застройщик. ПИК;1С, 1С: Предприятие, Системный анализ;08.06.2026
Системный аналитик;Системный аналитик 1С: Зарплата и управление персоналом (ЗУП);;;;;Москва;Красное & Белое, розничная сеть;1С: Зарплата и управление персоналом, Системный анализ, Оптимизация бизнес-процессов, Автоматизация, Разработка инструкций, Постановка задач разработчикам, Техническое задание, Моделирование бизнес процессов;09.06.2026
Системный аналитик;Эксперт Системный аналитик (развитие команды);;;;3.0;Рыбинск;BIV;Системный анализ, UML, BPMN, Руководство коллективом;08.06.2026
Системный аналитик;Системный аналитик 1С: Зарплата и управление персоналом (ЗУП);;;;;Краснодар;Красное & Белое, розничная сеть;1С: Зарплата и управление персоналом, Системный анализ, Оптимизация бизнес-процессов, Автоматизация, Разработка инструкций, Постановка задач разработчикам, Техническое задание, Моделирование бизнес процессов;09.06.2026
Системный аналитик;Системный аналитик;;;;;Москва;ООО ФАКЕЛ;;05.06.2026
Системный аналитик;Системный аналитик;170000;;net;3.0;Москва;Форум-Авто;Kibana, Elasticsearch, Grafana, Linux, REST, SOAP, Swagger;05.06.2026
Системный аналитик;Системный аналитик;;;;3.0;Москва;Сбер. IT;;05.06.2026
Системный аналитик;Продуктовый аналитик;180000;250000.0;net;;Москва;BelkaCar;SQL, Python, Анализ данных, А/В тесты, Математическая статистика;08.06.2026
Системный аналитик;Системный аналитик;;;;3.0;Москва;Лига Цифровой Экономики;SQL, REST API, Разработка функциональных требований;05.06.2026
Системный аналитик;Бизнес-аналитик 1С;;;;;Уфа;ООО Створ;1С-Битрикс, API;09.06.2026
Системный аналитик;Бизнес-аналитик;;;;;Екатеринбург;Монетка, Торговая сеть;;08.06.2026
Системный аналитик;Бизнес-аналитик;;;;;Казань;ГК ICL;UML, ГОСТ, IDEF0, Постановка задач разработчикам;08.06.2026
